<?xml version="1.0" encoding="UTF-8"?>
<!--

    Copyright (c) 2019 Friedrich-Alexander University Erlangen-Nuernberg (FAU)

    SPDX-License-Identifier: AGPL-3.0-only

-->
<cim:Weather xmlns:cim="http://iec.ch/TC57/Weather#" xmlns:xsi="http://www.w3.org/2001/XMLSchema-instance" xsi:schemaLocation="http://iec.ch/TC57/Weather# Weather.xsd">
	<cim:EnvironmentalMonitoringStation>
		<cim:mRID>String</cim:mRID>
		<cim:EnvironmentalAnalog>
			<cim:kind>ambientTemperature</cim:kind>
			<cim:unitMultiplier>none</cim:unitMultiplier>
			<cim:unitSymbol>degC</cim:unitSymbol>
			<cim:AnalogValues>
				<cim:timeStamp>__TIMESTAMP__</cim:timeStamp>
				<cim:value>__TEMP_IN_C__</cim:value>
			</cim:AnalogValues>
		</cim:EnvironmentalAnalog>
		<cim:EnvironmentalAnalog>
			<cim:kind>irradianceGlobalHorizontal</cim:kind>
			<cim:unitMultiplier>a</cim:unitMultiplier>
			<cim:unitSymbol>WPerm2</cim:unitSymbol>
			<cim:AnalogValues>
				<cim:timeStamp>__TIMESTAMP__</cim:timeStamp>
				<cim:value>__SOLAR_RADIATION__</cim:value>
			</cim:AnalogValues>
		</cim:EnvironmentalAnalog>
		<cim:Location>
			<cim:mainAddress>
				<cim:townDetail>
					<cim:name>__CITY__</cim:name>
				</cim:townDetail>
			</cim:mainAddress>
		</cim:Location>
	</cim:EnvironmentalMonitoringStation>
</cim:Weather>
